{"case_id":"C022","gap_exists":false,"gap_type":[],"confidence":97,"affected_functions":["BROTLI_TZCNT64","BrotliBsf64Msvc","BrotliBsr32Msvc","BROTLI_BSR32"],"reason":"The change only raises three compile-time MSVC feature guards from BROTLI_MSVC_VERSION_CHECK(12, 0, 0) to BROTLI_MSVC_VERSION_CHECK(18, 0, 0), controlling <intrin.h> and MSVC-specific bit-scan/count implementations. It introduces no new runtime entry point, API protocol, decoder state, configuration accepted at runtime, input semantics, or data-dependent attack surface. H0 already drives BrotliDecoderDecompressStream with arbitrary bytes and varied input chunking; its use of $CC does not cover MSVC-version compilation, but that is a build-compatibility matrix concern rather than a material fuzz-harness gap.","evidence":["c/common/platform.h changes only BROTLI_MSVC_VERSION_CHECK thresholds around <intrin.h>, BROTLI_TZCNT64, BrotliBsf64Msvc, and BrotliBsr32Msvc/BROTLI_BSR32.","decode_fuzzer.c supplies arbitrary data to BrotliDecoderDecompressStream and exercises both whole-input and 1-to-7-byte incremental-input paths.","No production runtime logic, public API, or input parsing behavior is added or modified by S1."],"recommended_action":"Do not add a fuzz target for this change; validate the affected MSVC version configurations through compile/build-matrix testing instead."}