{"case_id":"T5016","gap_exists":true,"gap_type":["entry_point","API protocol","configuration","input semantics","attack surface"],"confidence":99,"affected_functions":["meshopt_generateNormals","computeFaceNormals","buildVertexRemap","buildCornerAdjacency"],"reason":"H0 never invokes the newly exposed production entry point meshopt_generateNormals. Its protocol and input space are materially distinct: indexed versus unindexed operation through nullable indices, index_count/vertex_count relationships, vertex_positions_stride values from 12 through 256, crease_angle values, arbitrary topology, duplicate positions, and degenerate triangles. The implementation uses indices to access vertex_positions, constructs a remap and corner adjacency, allocates buffers sized from vertex_count/index_count, computes and normalizes cross products, and writes index_count*3 floats to result; none of these paths or invariants is exercised by the existing meshlet, codec, or simplification harness calls.","evidence":["src/meshoptimizer.h declares meshopt_generateNormals(float* result, const unsigned int* indices, size_t index_count, const float* vertex_positions, size_t vertex_count, size_t vertex_positions_stride, float crease_angle).","meshopt_generateNormals accepts both indexed input and unindexed input, enforced by assert(indices || index_count == vertex_count), but H0 contains no call covering either mode.","meshopt_generateNormals requires index_count % 3 == 0 and vertex_positions_stride >= 12 && vertex_positions_stride <= 256, creating parameter-boundary and shape semantics absent from H0.","meshopt_generateNormals calls buildVertexRemap and buildCornerAdjacency using fuzz-relevant vertex positions, indices, counts, and stride.","computeFaceNormals dereferences vertex_positions using indices and performs cross-product normalization, including the nl != 0.f branch for degenerate triangles.","meshopt_generateNormals writes result[i * 3] for every corner and allocates remap, face_normals, and groups according to vertex_count, face_count, and index_count.","tools/clusterfuzz.cpp exercises meshlet construction and meshopt_partitionClusters; tools/codecfuzz.cpp exercises codecs; tools/simplifyfuzz.cpp exercises simplification. None references meshopt_generateNormals."],"recommended_action":"Add a dedicated meshopt_generateNormals fuzz target or extend an appropriate geometry harness to derive bounded counts, indices, positions, output capacity, stride, and crease_angle from fuzz data. Exercise both indices == NULL and indexed modes; valid stride boundaries and varied alignment; duplicate, non-finite, collinear, and degenerate positions; repeated and adversarial valid indices; empty meshes; and multiple crease_angle values, while maintaining the documented count and buffer-size preconditions."}