{"case_id":"T8044","gap_exists":true,"gap_type":["API protocol","state","entry point"],"confidence":99,"affected_functions":["h2o_qpack_flatten_request","h2o_qpack_flatten_response","h2o_qpack_parse_request","h2o_qpack_parse_response","prepare_flatten"],"reason":"S1 changes the public QPACK statistics contract from overwriting output to accumulating into caller-initialized state. H0 neither supplies the required stats argument to h2o_qpack_flatten_request nor observes accumulator behavior. It also performs only one request-flatten operation, leaving nonzero initial state, repeated-call accumulation, parsing, and response flattening unexercised.","evidence":["S1 removes `*stats = (h2o_qpack_header_stats_t){0}` from `prepare_flatten`, `h2o_qpack_parse_request`, and `h2o_qpack_parse_response`.","The declarations and implementations rename the parameter to `stats_updated` and state that callers must initialize or reset it and that QPACK functions add per-section statistics.","H0 calls `h2o_qpack_flatten_request(..., headers.size, h2o_iovec_init(NULL, 0))` without the final `h2o_qpack_header_stats_t *stats_updated` argument required by S1.","H0 does not initialize a `h2o_qpack_header_stats_t`, seed it with nonzero values, invoke multiple QPACK operations against it, or validate `count` and `text_bytes`.","H0 never invokes `h2o_qpack_parse_request`, `h2o_qpack_parse_response`, or `h2o_qpack_flatten_response`, although S1 applies the same accumulator protocol to those entry points."],"recommended_action":"Make H0 pass an initialized `h2o_qpack_header_stats_t` and add fuzz oracles for exact `count` and `text_bytes` deltas from nonzero initial values and across repeated sections. Add coverage for request/response parsing and response flattening, including success and invalid-header-character soft-fail paths, to verify that each API accumulates without resetting caller state."}