{"case_id":"C077","gap_exists":true,"gap_type":["API protocol","state","input semantics"],"confidence":99,"affected_functions":["fuzz","wuffs_gif__decoder__decode_config","wuffs_base__image_config__is_valid","wuffs_base__image_config__num_loops","wuffs_base__image_buffer__loop"],"reason":"H0 is materially incompatible with S1 and also omits newly exposed GIF animation state. The harness calls the removed wuffs_base__image_config__valid API, so it cannot exercise S1 as written. Moreover, wuffs_gif__decoder__decode_config now propagates input-derived f_num_loops into wuffs_base__image_config, but H0 only uses pixbuf_size and never observes num_loops or exercises the stateful wuffs_base__image_buffer__loop behavior.","evidence":["H0 calls wuffs_base__image_config__valid(&ic), while S1 replaces that identifier with wuffs_base__image_config__is_valid.","S1 changes wuffs_gif__decoder__decode_config to call wuffs_base__image_config__initialize with self->private_impl.f_num_loops.","S1 adds wuffs_base__image_config__num_loops and the stateful wuffs_base__image_buffer__loop, whose behavior differs for num_loops == 0, remaining finite loops, and exhausted loops.","H0 proceeds directly from decode_config to pixbuf_size and repeated wuffs_gif__decoder__decode_frame calls; it never constructs a wuffs_base__image_buffer or calls wuffs_base__image_config__num_loops or wuffs_base__image_buffer__loop."],"recommended_action":"Update H0 to use wuffs_base__image_config__is_valid, then extend it to consume the decoded wuffs_base__image_config through wuffs_base__image_buffer and exercise wuffs_base__image_buffer__loop for fuzzed GIF loop-count metadata, including zero, finite, and boundary counts."}