{"case_id":"T8102","gap_exists":false,"gap_type":[],"confidence":93,"affected_functions":["MemoryOffsetAllocator::run","StackLimitEvader::run"],"reason":"The changed behavior is within Yul optimization and is driven by source-expressible structures. H0 already parses arbitrary Yul input with `YulStack`, enables `OptimiserSettings::full()`, and calls `stack.optimize()`. Inputs can therefore contain `memoryguard` calls, mutually recursive functions, component-adjacent calls, and variables that exercise the new strongly-connected-component allocation logic. No distinct entry point, protocol, state, or configuration required by the supplied change is visibly omitted.","evidence":["H0 calls `stack.parseAndAnalyze(\"source\", input)` followed by `stack.optimize()` using `OptimiserSettings::full()`.","`StackLimitEvader::run` derives `callGraph`, `recursiveFunctions`, `stronglyConnectedComponents`, and `componentOfFunction` from the analyzed `_astRoot`; these are controlled by the fuzzed Yul source.","The guarded path depends on source constructs visible in the diff, including `memoryguard` calls and `_unreachableVariables`, rather than on a separate public API or external state.","`MemoryOffsetAllocator::run` is reached through the same optimization flow and directly processes SCC members, outgoing calls, function definitions, parameters, return variables, and unreachable variables.","The 600-byte limit does not visibly exclude the compact Yul constructs needed to express mutual recursion, a `memoryguard` call, and stack-heavy functions."],"recommended_action":"Retain H0; strengthen its seed corpus with compact Yul programs containing `memoryguard`, mutually recursive functions, outgoing calls across SCC boundaries, and stack-unreachable variables rather than adding a separate harness."}