{"case_id":"T5036","gap_exists":true,"gap_type":["missing_entry_point","configuration_boundary","input_semantics","two_phase_api_protocol"],"confidence":99,"affected_functions":["meshopt_remesh","voxelize"],"reason":"H0 never calls the changed public entry point `meshopt_remesh`. It therefore does not exercise the resolution range `4..256`, including the new upper boundary `256`, or `voxelize` coordinate handling for negative, out-of-range, and non-finite position-derived values. It also misses the counting-versus-output behavior selected by a null or non-null `destination` and bounded by `max_triangle_count`.","evidence":["`meshopt_remesh` is the sole visible public function containing the changed production path, but it does not appear in `tools/clusterfuzz.cpp`, `tools/codecfuzz.cpp`, or `tools/simplifyfuzz.cpp`.","S1 changes the resolution assertion to `resolution >= 4 && resolution <= 256`.","`voxelize` now computes `cutoff = resolution - 3` and maps coordinates using `unsigned(x) < unsigned(cutoff) ? x : cutoff`, explicitly affecting negative, excessive, and non-finite-derived coordinates.","`meshopt_remesh` conditionally allocates and populates `voxel_rows` and `voxels` only when `destination` is non-null, while `polygonize` separately observes `max_triangle_count`.","H0 covers meshlet building, cluster partitioning, codecs, and simplification, but no remeshing or voxel-grid path."],"recommended_action":"Add a dedicated `meshopt_remesh` fuzz target using valid triangle-index topology and fuzz-controlled vertex positions, strides, resolutions, options, and output capacities. Include resolutions 4, 5, 255, and 256; finite boundary coordinates plus negative, very large, NaN, and infinity values; and compare a null-destination counting call with non-null calls using zero, undersized, and sufficient `max_triangle_count`, with sanitizer-backed bounds checks."}