{"case_id":"C005","gap_exists":true,"gap_type":["API protocol","configuration","input semantics","attack surface"],"confidence":99,"affected_functions":["fuzz_swizzle_ycck","wuffs_base__pixel_swizzler__swizzle_ycck","wuffs_base__pixel_swizzler__swizzle_ycc__general__triangle_filter","wuffs_base__pixel_swizzler__swizzle_ycc__general__triangle_filter_single_row","wuffs_base__pixel_swizzler__swizzle_ycc__upsample_inv_h2vn_box","wuffs_base__pixel_swizzler__swizzle_ycc__upsample_inv_h3vn_box","wuffs_base__pixel_swizzler__swizzle_ycc__upsample_inv_h4vn_box"],"reason":"H0 does not conform to S1's changed swizzle_ycck API and does not exercise the newly reachable triangle-filter branch. Its call ends with triangle_filter_for_2to1=false and supplies no scratch_buffer_2k argument, while S1 requires a scratch slice of at least 2048 bytes and enters the new upsampling implementation only when triangle_filter_for_2to1 is true with a qualifying inverse sampling ratio. Thus H0 both fails the new call protocol and misses fuzzing scratch-buffer boundaries and the memory-sensitive chunked upsampling path.","evidence":["S1 adds wuffs_base__slice_u8 scratch_buffer_2k to wuffs_base__pixel_swizzler__swizzle_ycck, but fuzz_swizzle_ycck calls it with false as the final argument and no scratch slice.","S1 rejects calls when scratch_buffer_2k.len < 2048u, introducing a caller-controlled buffer contract absent from H0.","H0 fixes triangle_filter_for_2to1 to false; S1 dispatches to wuffs_base__pixel_swizzler__swizzle_ycc__general__triangle_filter only when that flag is true and has_triangle_upsampler accepts an inv_h/inv_v combination.","The new triangle path partitions scratch_buffer_2k.ptr into offsets 0 * 672, 1 * 672, and 2 * 672 and performs repeated writes in the h2, h3, and h4 upsamplers, making buffer size, placement, and chunk-boundary cases fuzz-worthy.","H0 limits width and height to 1..63, so it cannot exercise the triangle path's 672-pixel chunk boundary or multiple iterations of while (x < width).","H0 fills each source plane using memset with one byte per plane, which substantially suppresses input variation through the new upsampling and color-conversion loops."],"recommended_action":"Update fuzz_swizzle_ycck to pass a guarded scratch slice and fuzz its valid and short lengths; vary triangle_filter_for_2to1 across false and true; generate qualifying h/v ratios; extend dimensions across 672-pixel boundaries; and populate source planes with fuzz bytes rather than uniform memset values. Preserve guarded allocations for source, destination, and scratch buffers and explicitly test the 2047/2048-byte scratch boundary."}