{"case_id":"C067","gap_exists":true,"gap_type":["entry_point","configuration","attack_surface"],"confidence":95,"affected_functions":["wuffs_vp8__decoder__decode_subblock_modes"],"reason":"H0 exclusively configures and invokes the BZIP2 decoder, while S1 also changes the VP8 decoder path. Consequently, fuzz inputs in H0 cannot exercise the VP8 state processing in wuffs_vp8__decoder__decode_subblock_modes, including its CLAMP_NO_MORE_THAN_9-indexed top_mode and left_mode handling.","evidence":["H0 defines WUFFS_CONFIG__MODULE__BZIP2 and does not configure a VP8 module.","H0's fuzz function only initializes wuffs_bzip2__decoder and calls wuffs_bzip2__decoder__transform_io.","S1 changes wuffs_vp8__decoder__decode_subblock_modes and the VP8 constant WUFFS_VP8__CLAMP_NO_MORE_THAN_9.","The changed VP8 function derives top_mode and left_mode from decoder state and uses them in wuffs_vp8__decoder__decode_one_subblock_mode, but H0 has no VP8 decoding path."],"recommended_action":"Add a separate VP8 decoder fuzz target that accepts encoded input and reaches wuffs_vp8__decoder__decode_subblock_modes, including varied macroblock state and luma_mode paths; retain H0 for the BZIP2 paths."}