{"case_id":"C023","gap_exists":true,"gap_type":["API entry point","boundary input semantics","C-language sanitizer configuration"],"confidence":98,"affected_functions":["wuffs_base__make_slice_u8_ij","wuffs_base__make_slice_u16_ij","wuffs_base__make_slice_u32_ij","wuffs_base__make_slice_u64_ij","wuffs_base__slice_u8__subslice_i","wuffs_base__slice_u8__subslice_ij"],"reason":"H0 fuzzes JSON decoding but never directly fuzzes the changed base slice constructors or subslice APIs with the null-pointer and zero-index combinations implicated by S1. The source comments specifically identify pre-C29 C undefined behavior and UBSan for `NULL + 0`, while H0 is `json_fuzzer.cc` and its explicit auxiliary path is guarded by `__cplusplus`, leaving the relevant C compilation configuration uncovered.","evidence":["S1 changes all four `wuffs_base__make_slice_*_ij` pointer expressions from `ptr ? (ptr + i) : NULL` to `i ? (ptr + i) : ptr`.","S1 changes `wuffs_base__slice_u8__subslice_i` and `wuffs_base__slice_u8__subslice_ij` to avoid evaluating `s.ptr + i` when `i == 0`.","The changed-function comments explicitly state that `NULL + 0` is undefined behavior in C prior to C29 and triggers UBSan, but not in C++.","H0's entry points exercise `wuffs_json__decoder__decode_tokens` and `wuffs_aux::DecodeJson`; none directly invoke any of the six changed slice helpers or construct targeted `{ptr == NULL, i == 0}` arguments.","H0 is supplied as `fuzz/c/std/json_fuzzer.cc`, so its normal source-language surface does not directly cover the C-only behavior identified in the changed comments."],"recommended_action":"Add a base-slice fuzz target compiled as C with UBSan that directly calls all changed helpers, explicitly covering `ptr` or `s.ptr` equal to `NULL` with `i == 0`, including `j == 0`, valid empty slices, out-of-bounds indices, reversed `i`/`j`, and `SIZE_MAX` boundaries; assert returned pointer/length semantics without dereferencing invalid slices."}