{"case_id":"T8013","gap_exists":true,"gap_type":["entry_point","stateful_recursion","input_semantics","resource_exhaustion"],"confidence":98,"affected_functions":["xmlXIncludeDoProcess","xmlXIncludeRecurseDoc","xmlXIncludeLoadFallback"],"reason":"H0 exercises parsing, serialization, push parsing, and reader traversal, but never explicitly performs XInclude processing. The changed code concerns recursive inclusions, inclusions inside fallback content, propagation of the new incTotal state across nested contexts, and a fuzz-build replacement limit. Those behaviors require processing XInclude nodes and resources, so merely parsing docBuffer does not demonstrably reach the implicated attack surface.","evidence":["H0 calls xmlReadMemory, xmlDocDumpMemory, xmlCreatePushParserCtxt/xmlParseChunk, and xmlReaderForMemory/xmlTextReaderRead; it contains no XInclude-processing call.","xmlXIncludeDoProcess increments ctxt->incTotal for every node accepted by xmlXIncludeTestNode and, under FUZZING_BUILD_MODE_UNSAFE_FOR_PRODUCTION, rejects totals of 20 or more.","xmlXIncludeRecurseDoc copies incTotal into newctxt before xmlXIncludeDoProcess and copies it back afterward, showing that recursive included documents are part of the changed state protocol.","xmlXIncludeLoadFallback likewise propagates incTotal while reprocessing fallback children, so XInclude elements nested in fallback content are specifically implicated.","H0's xmlFuzzReadEntities and xmlFuzzEntityLoader provide resource data and loading machinery, but H0 only feeds that machinery to parser interfaces and does not explicitly initiate the XInclude replacement phases implemented by xmlXIncludeDoProcess."],"recommended_action":"Add an XInclude-processing fuzz path after document construction, using the existing fuzz entity loader and generated resources. Seed and mutate nested include documents and fallback children so processing reaches xmlXIncludeDoProcess, xmlXIncludeRecurseDoc, and xmlXIncludeLoadFallback, including inputs that approach and exceed 20 total replacements."}