{"case_id":"T8077","gap_exists":false,"gap_type":[],"confidence":98,"affected_functions":["plist_from_json"],"reason":"H0 directly fuzzes the changed public JSON parsing entry point with arbitrary byte buffers and lengths. Inputs containing more than 256 JSON tokens can drive the modified token-allocation, zero-initialization, and repeated JSMN_ERROR_NOMEM retry logic, so the supplied change does not expose a materially distinct unfuzzed entry point, protocol, state, configuration, input semantic, or attack surface.","evidence":["H0 calls plist_from_json(reinterpret_cast<const char*>(data), size, &root_node) for every fuzzer input.","The only changed production function is plist_from_json in src/jplist.c.","The changed behavior is controlled by JSON token demand through maxtoks, curtoks, realloc, memset, jsmn_parse, and the loop condition r == JSMN_ERROR_NOMEM; arbitrary structured JSON supplied by H0 can exercise that behavior.","H0 frees the resulting root_node with plist_free, covering successful parse results as well as parser rejection paths."],"recommended_action":"Retain H0; add corpus seeds with deeply nested or token-dense JSON exceeding 256 tokens to improve reachability, but no new harness is required."}