{"case_id":"C018","gap_exists":false,"gap_type":[],"confidence":99,"affected_functions":["fuzz","fuzz_image_decoder","wuffs_webp__decoder__initialize","wuffs_vp8__decoder__do_decode_frame","wuffs_vp8__decoder__decode_header_partition","wuffs_vp8__decoder__copy_partitions_to_workbuf","wuffs_vp8__decoder__decode_other_partition_lengths"],"reason":"No material fuzz-harness gap is visible. H0 enables both WUFFS_CONFIG__MODULE__WEBP and WUFFS_CONFIG__MODULE__VP8, initializes wuffs_webp__decoder, and passes its image-decoder interface to fuzz_image_decoder. The S1 execution path still reaches the changed VP8 header-partition logic through wuffs_vp8__decoder__do_decode_frame. The generated-C change renames wuffs_vp8__decoder__decode_first_partition to wuffs_vp8__decoder__decode_header_partition without changing its shown body or introducing a new public entry point, protocol, configuration, or independently selectable input mode.","evidence":["H0 defines WUFFS_CONFIG__MODULE__VP8 and WUFFS_CONFIG__MODULE__WEBP.","H0 calls fuzz_image_decoder with wuffs_webp__decoder__upcast_as__wuffs_base__image_decoder(&dec), exercising decoding through the existing image-decoder API.","In S1, wuffs_vp8__decoder__do_decode_frame calls wuffs_vp8__decoder__decode_header_partition after copy_partitions_to_workbuf and before decode_other_partition_lengths and decode_macroblocks.","The displayed generated-C body of wuffs_vp8__decoder__decode_header_partition is unchanged from the renamed wuffs_vp8__decoder__decode_first_partition body.","The new std/vp8/decode_header_partition.wuffs contains private decoder functions, including decoder.decode_header_partition, rather than a new public fuzz-worthy API."],"recommended_action":"Keep H0 unchanged; no additional harness entry point or mode is justified by the supplied source change."}